"id","name","model_id:id","group_id:id","perm_read","perm_write","perm_create","perm_unlink"
"izi_stock_allocation.access_stock_allocation_move_crud_group_user","Stock Allocation Move Access for Group User: CRUD","izi_stock_allocation.model_stock_allocation_move",,1,1,1,1
"izi_stock_allocation.access_stock_allocation_balance_crud_group_user","Stock Allocation Balance Access for Group User: CRUD","izi_stock_allocation.model_stock_allocation_balance",,1,1,1,1
"izi_stock_allocation.access_stock_allocation_balance_line_crud_group_user","Stock Allocation Balance Line Access for Group User: CRUD","izi_stock_allocation.model_stock_allocation_balance_line",,1,1,1,1
"izi_stock_allocation.access_stock_allocation_stock_line_crud_group_user","Stock Allocation Stock Line Access for Group User: CRUD","izi_stock_allocation.model_stock_allocation_stock_line",,1,1,1,1
"izi_stock_allocation.access_stock_allocation_balance_current_crud_group_user","Stock Allocation Balance Current Access for Group User: CRUD","izi_stock_allocation.model_stock_allocation_balance_current",,1,1,1,1
"izi_stock_allocation.access_stock_allocation_wizard_crud_group_user","Stock Allocation Wizard Access for Group User: CRUD","izi_stock_allocation.model_stock_allocation_wizard",,1,1,1,1